{
  "$schema": "https://json-schema.org/draft/2020-12/schema",
  "$id": "jmud:room:v10",
  "title": "Room (v10)",
  "type": "object",
  "additionalProperties": false,
  "required": [
    "schema_version",
    "id",
    "name",
    "description",
    "item_ids"
  ],
  "properties": {
    "schema_version": {
      "type": "integer",
      "const": 10
    },
    "id": {
      "type": "string",
      "pattern": "^[a-z0-9-]+$"
    },
    "name": {
      "type": "string",
      "minLength": 1
    },
    "description": {
      "type": "string",
      "minLength": 1
    },
    "item_ids": {
      "type": "array",
      "items": {
        "type": "string",
        "pattern": "^[a-z0-9-]+$"
      }
    },
    "exits": {
      "type": "object",
      "description": "Optional map of direction (north/south/east/west/up/down) to destination room id.",
      "additionalProperties": {
        "type": "string",
        "pattern": "^[a-z0-9-]+$"
      }
    },
    "locked_exits": {
      "type": "object",
      "description": "Optional map of direction to the item id of the key required to unlock that exit.",
      "additionalProperties": {
        "type": "string",
        "pattern": "^[a-z0-9-]+$"
      }
    },
    "hidden_exits": {
      "type": "object",
      "description": "Optional map of direction (north/south/east/west/up/down) to destination room id for secret exits. A hidden exit is omitted from the rendered 'Exits:' line and cannot be walked through with a normal direction command until a player finds it with the SEARCH command; once discovered it becomes a normal, visible, walkable exit for every player until the server restarts. Discovery state is tracked in memory (never persisted), so it is world-scoped and resets on restart. A hidden exit may also be locked (list the same direction under locked_exits): discovery reveals it but does not unlock it.",
      "additionalProperties": {
        "type": "string",
        "pattern": "^[a-z0-9-]+$"
      }
    },
    "min_level": {
      "type": "integer",
      "minimum": 1,
      "description": "Optional recommended/minimum level to enter this room. Advisory only: it never blocks movement, it only triggers a warning message to players below this level. Omit for no restriction."
    },
    "night_description": {
      "type": "string",
      "minLength": 1,
      "description": "Optional alternate description shown instead of 'description' when the world clock is at night. Omit for no change at night."
    },
    "light_level": {
      "type": "integer",
      "minimum": 0,
      "description": "Optional ambient light level: 0 = pitch dark, 1 = dim, 2 or higher = naturally lit. Omit for a naturally lit room that needs no carried light. Dark rooms hide their contents from players who carry no sufficient light source; a pitch-dark room (0) requires a light radius of at least 1 (a torch), a dim room (1) requires at least 2 (a lantern)."
    },
    "is_outdoor": {
      "type": "boolean",
      "description": "Optional flag marking the room as exposed to the sky and therefore subject to the world's dynamic weather. Omit or set false for indoor rooms, which never show weather effects."
    },
    "ambient_messages": {
      "type": "array",
      "description": "Optional pool of atmospheric flavour lines the room emits occasionally during play (e.g. dripping water, distant howls). Omit or leave empty for a silent room. The ambient message engine picks one line at a time and delivers it to everyone in the room.",
      "items": {
        "type": "string",
        "minLength": 1
      }
    },
    "hazard": {
      "type": "object",
      "additionalProperties": false,
      "description": "Optional standing environmental hazard. When present, every player physically in this room takes typed, resistance-mitigated damage each tick (mitigated by the player's equipped *_resist gear exactly as a mob's matching typed attack would be, capped at the same combat max-resistance percent). The hazard is always surfaced plainly in the room's rendered LOOK description so it is never a surprise, and its damage reuses the standard death → corpse → respawn flow with no special-case. Omit for inert terrain.",
      "required": [
        "damage_type",
        "damage_min",
        "damage_max",
        "damage_message"
      ],
      "properties": {
        "damage_type": {
          "type": "string",
          "enum": ["FIRE", "COLD", "POISON"],
          "description": "The resistible element this hazard deals. Must not be PHYSICAL, so the promised resistance-gear mitigation always applies."
        },
        "damage_min": {
          "type": "integer",
          "minimum": 1,
          "description": "Inclusive minimum raw damage dealt per tick before resistance mitigation."
        },
        "damage_max": {
          "type": "integer",
          "minimum": 1,
          "description": "Inclusive maximum raw damage dealt per tick before resistance mitigation. Must be >= damage_min."
        },
        "damage_message": {
          "type": "string",
          "minLength": 1,
          "description": "Player-facing line delivered to a victim each time the hazard bites."
        }
      }
    }
  }
}
